effective_year,old_name,old_symbol,new_name,new_symbol,effective_date,source_ids
2023,JWD INFOLOGISTICS PUBLIC COMPANY LIMITED,JWD,SCGJWD LOGISTICS PUBLIC COMPANY LIMITED,SJWD,2/17/2023,web:19
2023,UNITED POWER OF ASIA PUBLIC COMPANY LIMITED,UPA,GREEN TECH VENTURES PUBLIC COMPANY LIMITED,GTV,3/1/2023,web:30
2023,SIAM MAKRO PUBLIC COMPANY LIMITED,MAKRO,CP AXTRA PUBLIC COMPANY LIMITED,CPAXT,6/21/2023,web:38
2024,JASMINE BROADBAND INTERNET INFRASTRUCTURE FUND,JASIF,3BB INTERNET INFRASTRUCTURE FUND,3BBIF,2/27/2024,web:32
2024,GIFT INFINITE PUBLIC COMPANY LIMITED,GIFT,RSXYZ PUBLIC COMPANY LIMITED,RSXYZ,12/24/2024,web:16
2025,WOW FACTOR PUBLIC COMPANY LIMITED,W,X BIOSCIENCE PUBLIC COMPANY LIMITED,XBIO,1/13/2025,web:18
2026,NEWS NETWORK CORPORATION PUBLIC COMPANY LIMITED,NEWS,SPT X PUBLIC COMPANY LIMITED,SPTX,1/20/2026,web:7
2026, ,STEC, ,STECON,1/20/2026, 
